{
  "$schema": "https://json-schema.org/draft/2020-12/schema",
  "type": "array",
  "items": {
    "type": "object",
    "required": [
      "id",
      "title",
      "group",
      "description",
      "order",
      "availability"
    ],
    "properties": {
      "id": {
        "pattern": "^[a-z][a-z0-9-]*$",
        "type": "string"
      },
      "title": {
        "minLength": 1,
        "type": "string"
      },
      "group": {
        "anyOf": [
          {
            "const": "rules",
            "type": "string"
          },
          {
            "const": "basic-strategy",
            "type": "string"
          },
          {
            "const": "memory",
            "type": "string"
          },
          {
            "const": "partnership",
            "type": "string"
          },
          {
            "const": "advanced",
            "type": "string"
          }
        ]
      },
      "description": {
        "minLength": 1,
        "type": "string"
      },
      "order": {
        "minimum": 1,
        "type": "integer"
      },
      "availability": {
        "anyOf": [
          {
            "const": "available",
            "type": "string"
          },
          {
            "const": "roadmap",
            "type": "string"
          }
        ]
      }
    }
  }
}
